{
  "$schema": "https://json-schema.org/draft/2020-12/schema",
  "$id": "https://zaentrum.github.io/schemas/library/v2/package.schema.json",
  "title": "versions/<versionId>/package.json and extras/<extraId>/package.json — what the packager produced",
  "description": "Written once by the packager, when the package completes, and never touched again. It sits next to the bytes it describes, so it can never end up describing a different package, and it is the record a rebuild reads to restore the playback rows: everything the v1 manifest's playback section carried is here, under the same names.\n\nAn extra's package (extras/<extraId>/, see extra.schema.json) is described by this same record, with two differences. Its checksums.sha256 lists extra.json, the extra's originals and every package file — an extra is written whole and no event deletes its original — and it carries no trailers: a trailer that is a file of its own is an extra of kind trailer.\n\nBecause it is written only on completion, there is no 'building' or 'failed' state to record — an unfinished package has no package.json and no .complete marker, and neither the database nor a rebuild will use it. A package that falls out of date later is not rewritten either: a new version folder holds the new package, and an events/…-package-superseded.json record says this one was replaced.\n\nThe records a rebuild trusts are covered by one chain, each link written after the one it covers:\n  .complete         written last; holds 'sha256:<hex>' of this file, and nothing else\n  package.json      this file; checksums.sha256 records the hash of the checksums file\n  checksums.sha256  version.json and every file of the package, sha256sum -c format\nso `sha256sum -c checksums.sha256` proves version.json and the package, the hash here proves the checksums file, and .complete proves this file. The checksums file cannot list .complete, this file or itself — each holds the hash of the next link down — and it does not list the originals, which are covered by their source records' fixity and may be deleted later.\n\nPaths: renditions[].dir, subtitles[].path, subtitles[].hls, trickplay.vttPath, hls.master, trailers[].manifestPath and checksums.file are relative to the version or extra folder THIS record sits in. subtitles[].fromSidecar is the one path relative to the ITEM folder: it names the copy a source folder keeps of the sidecar the subtitle was made from.",
  "type": "object",
  "required": ["schema", "packageId", "createdAt", "packagedBy", "state", "role", "durationMs", "renditions", "fidelity", "essence", "checksums"],
  "additionalProperties": false,
  "properties": {
    "schema": { "const": "zaentrum.library.package/2" },
    "packageId": { "$ref": "defs.schema.json#/$defs/uuid" },
    "createdAt": { "$ref": "defs.schema.json#/$defs/timestamp", "description": "When the package completed. This is the v1 playback field packagedAt under the name every v2 record uses." },
    "packagedBy": { "type": "string", "description": "The v1 playback field packager." },
    "state": {
      "enum": ["complete", "stale"],
      "description": "'complete': finished and playable, and the version folder carries its .complete marker, which names this file's hash. 'stale' exists only for a record migrated from a v1 manifest that already said the package was outdated; nothing writes it now, because a package that goes out of date gets a package-superseded event instead of a new state here."
    },
    "role": {
      "enum": ["derived", "canonical"],
      "description": "What this package was when it was written: 'derived' when an original was kept beside it in its folder, 'canonical' when the package is the only copy. It is not rewritten when the original is deleted later — a reader that sees an original-deleted event for this version treats the package as canonical from then on, and every loss below becomes permanent."
    },

    "durationMs": { "type": "integer", "minimum": 0, "description": "v1 playback field: duration of this package." },
    "recipe": {
      "type": "object",
      "description": "How video, audio and subtitles were produced, so the same package can be made again.",
      "additionalProperties": false,
      "properties": {
        "video": { "type": ["string", "null"] },
        "audio": { "type": ["string", "null"] },
        "subtitles": { "type": ["string", "null"] }
      }
    },

    "renditions": {
      "type": "object",
      "description": "v1 playback field. More than one video entry is a quality ladder.",
      "required": ["video", "audio"],
      "additionalProperties": false,
      "properties": {
        "video": { "type": "array", "items": { "$ref": "#/$defs/videoRendition" } },
        "audio": { "type": "array", "items": { "$ref": "#/$defs/audioRendition" }, "description": "One stereo rendition per audio track of the original the package carries, in the playlist's stereo group." },
        "audioSurround": { "type": "array", "items": { "$ref": "#/$defs/audioRendition" }, "description": "The 5.1 companions of tracks the stereo renditions also carry, in an audio group of their own: the original's own surround stream, copied, or one encode of it. A track is listed once under audio whatever it has here, so a reader counts tracks there and channels in both." }
      }
    },
    "subtitles": { "type": "array", "items": { "$ref": "#/$defs/subtitleRendition" }, "description": "v1 playback field." },
    "trickplay": { "oneOf": [{ "$ref": "#/$defs/trickplay" }, { "type": "null" }], "description": "v1 playback field." },
    "hls": {
      "type": "object",
      "description": "How the package is laid out as HLS, as the packager wrote it: the master playlist a player opens, the length its media segments are cut to, the audio groups the master names — the stereo one and, with 5.1 companions, theirs — and the subtitle group, or null when the master names no subtitles.",
      "required": ["master", "segmentSeconds", "audioGroups", "subtitleGroup"],
      "additionalProperties": false,
      "properties": {
        "master": { "$ref": "defs.schema.json#/$defs/relPath" },
        "segmentSeconds": { "type": "integer", "minimum": 1 },
        "audioGroups": { "type": "array", "items": { "type": "string", "minLength": 1 }, "uniqueItems": true },
        "subtitleGroup": { "type": ["string", "null"], "minLength": 1 }
      }
    },
    "trailers": { "type": "array", "items": { "$ref": "#/$defs/trailer" }, "description": "v1 playback field: trailers packaged into this folder. Trailers published elsewhere are listed by reference in metadata.json, and a trailer that is a local file of its own is an extra of kind trailer (extras/<extraId>/), not one of these." },

    "sizeBytes": { "type": ["integer", "null"], "minimum": 0, "description": "Total size of the package's files: its rendition, subtitle, trickplay and trailer folders, not the records beside them." },
    "peakBandwidthBps": { "type": ["integer", "null"], "minimum": 0, "description": "The highest BANDWIDTH in the package's master playlist, audio included: a peak, not an average. The rendition field bitrateBps is often 0." },

    "fidelity": {
      "type": "object",
      "required": ["lossless", "losses"],
      "additionalProperties": false,
      "properties": {
        "lossless": { "type": "boolean" },
        "losses": {
          "type": "array",
          "description": "Every way the package is poorer than the original. Empty only when lossless.",
          "items": {
            "type": "object",
            "required": ["kind", "detail"],
            "additionalProperties": false,
            "properties": {
              "kind": { "enum": ["audio-downmix", "audio-codec", "audio-dropped", "video-resolution", "video-bitdepth", "dynamic-range", "dolby-vision", "stereo3d", "subtitle-dropped", "subtitle-styling", "closed-captions-dropped", "attachments-dropped", "other"] },
              "detail": { "type": "string" },
              "sourceStreamIndex": { "type": ["integer", "null"] }
            }
          }
        },
        "droppedSourceStreams": { "type": "array", "items": { "type": "integer" } }
      }
    },
    "essence": { "$ref": "defs.schema.json#/$defs/essence", "description": "What this package carries, in the same reduced terms as the source's, so the two can be compared. What the originals would cost to delete is not here but on the version, which can answer it whether or not anything has been packaged." },

    "checksums": {
      "type": "object",
      "description": "A sha256sum-style file listing version.json and every file of the package — the rendition, subtitle, trickplay and trailer folders — so a copy can be verified file by file; in an extra's folder, extra.json, the originals and every file of the package. It is written with the package, not later: once the original is gone the package is the truth, and this is its fixity. The one exception is a package a migration adopted with its checksums pending (pending), whose file is written once its files are hashed.",
      "required": ["file", "algorithm", "files", "bytes"],
      "oneOf": [{ "required": ["sha256"] }, { "required": ["pending"] }],
      "additionalProperties": false,
      "properties": {
        "file": { "const": "checksums.sha256", "description": "In this version folder: lines of '<hex digest>  <path>', paths relative to this folder." },
        "algorithm": { "const": "sha256" },
        "sha256": { "$ref": "defs.schema.json#/$defs/sha256", "description": "Hash of the checksums file itself: the link from this record down to the files it lists." },
        "pending": { "const": true, "description": "In place of sha256, while nothing has hashed the package's files yet: a package adopted from a store too large to read through in the time a migration had. No checksums file is written until every file is hashed; then this record is written again with sha256 in place of pending — its checksums the only thing that changes — and .complete names it. files and bytes say what the checksums file will list, counted without reading. A version whose checksums are pending is played as any other; its original is not deleted before they are filled." },
        "files": { "type": "integer", "minimum": 0, "description": "How many files it lists, version.json included — or extra.json and the originals, in an extra's folder." },
        "bytes": { "type": "integer", "minimum": 0, "description": "Their total size, the same files included." }
      }
    }
  },

  "$defs": {
    "videoRendition": {
      "type": "object",
      "required": ["id", "dir", "codec", "width", "height", "bitrateBps", "hdr", "frameRate", "segments", "targetDuration"],
      "additionalProperties": false,
      "properties": {
        "id": { "type": "string", "minLength": 1 },
        "dir": { "$ref": "defs.schema.json#/$defs/relPath" },
        "codec": { "type": "string" },
        "width": { "type": "integer" },
        "height": { "type": "integer" },
        "bitrateBps": { "type": "integer" },
        "hdr": { "type": "boolean" },
        "frameRate": { "type": "string" },
        "segments": { "type": "integer" },
        "targetDuration": { "type": "integer" },
        "dynamicRange": { "enum": ["sdr", "hdr10", "hdr10plus", "hlg", "dolby-vision", "unknown"] },
        "sourceStreamIndex": { "type": ["integer", "null"], "description": "The original's stream this was made from." },
        "peakBitrateBps": { "type": "integer", "minimum": 0, "description": "The highest bitrate of any segment of the rendition, where bitrateBps is the average." },
        "videoRange": { "enum": ["SDR", "PQ", "HLG"], "description": "The VIDEO-RANGE the master playlist gives the rendition." },
        "label": { "type": "string", "description": "The rung's name in the ladder, e.g. 'source', '1080p'." },
        "encoder": { "type": "string", "description": "What made the rung: 'copy' when it is the original's own stream, otherwise the encoder." }
      }
    },
    "audioRendition": {
      "type": "object",
      "required": ["id", "dir", "codec", "language", "default", "channels", "bitrateBps", "segments", "purpose", "purposeFrom"],
      "additionalProperties": false,
      "properties": {
        "id": { "type": "string", "minLength": 1 },
        "dir": { "$ref": "defs.schema.json#/$defs/relPath" },
        "codec": { "type": "string" },
        "language": { "$ref": "defs.schema.json#/$defs/language" },
        "title": { "type": "string" },
        "default": { "type": "boolean", "description": "What the packager wrote into the playlist, so a reader sees the package as it is. Which track a viewer actually gets is behaviour and comes from the database." },
        "channels": { "type": "integer" },
        "bitrateBps": { "type": "integer" },
        "segments": { "type": "integer" },
        "visible": { "type": "boolean", "description": "As written into the playlist; see default." },
        "sourceStreamIndex": { "type": ["integer", "null"] },
        "sourceChannels": { "type": ["integer", "null"], "description": "Channels of the original track, e.g. 6 when a 5.1 track was downmixed to stereo." },
        "purpose": { "$ref": "defs.schema.json#/$defs/audioPurpose" },
        "purposeFrom": { "$ref": "defs.schema.json#/$defs/purposeFrom" },
        "variant": { "type": ["string", "null"], "description": "Region or dialect, e.g. 'Castilian', 'Latin American'." },
        "original": { "type": ["boolean", "null"], "description": "True when the file flagged the track as the work's original language; null when unknown." },
        "group": { "type": "string", "minLength": 1, "description": "The HLS audio group the rendition is in, one hls.audioGroups names." },
        "name": { "type": "string", "description": "The NAME the master playlist gives the rendition." }
      }
    },
    "subtitleRendition": {
      "type": "object",
      "required": ["id", "path", "language", "format", "purpose", "purposeFrom"],
      "additionalProperties": false,
      "properties": {
        "id": { "type": "string", "minLength": 1 },
        "path": { "$ref": "defs.schema.json#/$defs/relPath" },
        "language": { "$ref": "defs.schema.json#/$defs/language" },
        "title": { "type": "string" },
        "default": { "type": "boolean", "description": "As written into the playlist; see the audio rendition's default." },
        "forced": { "type": "boolean", "description": "As written into the playlist. The content fact is purpose 'forced'." },
        "format": { "type": "string" },
        "visible": { "type": "boolean", "description": "As written into the playlist." },
        "sourceStreamIndex": { "type": ["integer", "null"] },
        "purpose": { "$ref": "defs.schema.json#/$defs/subtitlePurpose" },
        "purposeFrom": { "$ref": "defs.schema.json#/$defs/purposeFrom" },
        "variant": { "type": ["string", "null"], "description": "Region or script, e.g. 'Latin American', 'Simplified'." },
        "name": { "type": "string", "description": "The NAME the master playlist gives the subtitle's HLS rendition." },
        "hls": { "$ref": "defs.schema.json#/$defs/relPath", "description": "The folder of the subtitle's HLS rendition, when it was segmented into one." },
        "fromSidecar": { "$ref": "defs.schema.json#/$defs/relPath", "description": "The subtitle was made from a sidecar that sat beside the original, and this is the copy of it the source folder keeps: sources/<sourceId>/<name>, relative to the item folder — of a source this version was made from, and one its source.json lists among its sidecars. An extra has no source record, so no subtitle of an extra's package carries it." }
      }
    },
    "trickplay": {
      "type": "object",
      "required": ["vttPath", "spritePattern", "intervalSec", "thumbWidth", "thumbHeight", "gridCols", "gridRows"],
      "additionalProperties": false,
      "properties": {
        "vttPath": { "$ref": "defs.schema.json#/$defs/relPath" },
        "spritePattern": { "type": "string" },
        "intervalSec": { "type": "integer", "minimum": 1 },
        "thumbWidth": { "type": "integer" },
        "thumbHeight": { "type": "integer" },
        "gridCols": { "type": "integer" },
        "gridRows": { "type": "integer" }
      },
      "description": "The VTT maps each interval to one cell of one sprite sheet."
    },
    "trailer": {
      "type": "object",
      "required": ["id", "source", "durationMs", "manifestPath"],
      "additionalProperties": false,
      "properties": {
        "id": { "type": "string", "minLength": 1 },
        "source": { "type": "string" },
        "durationMs": { "type": "integer", "minimum": 0 },
        "manifestPath": { "$ref": "defs.schema.json#/$defs/relPath" }
      }
    }
  }
}
