{
  "schema": "zaentrum.library.package/2",
  "packageId": "8d7a70cf-1bed-566d-8249-3949acbae49d",
  "createdAt": "2026-10-06T10:05:00Z",
  "packagedBy": "shaka-packager v3.4.2",
  "state": "complete",
  "role": "canonical",
  "durationMs": 30000,
  "renditions": {
    "video": [
      {
        "id": "v0",
        "dir": "hls/v0",
        "codec": "avc1.640028",
        "width": 1920,
        "height": 800,
        "bitrateBps": 4000000,
        "hdr": false,
        "frameRate": "24/1",
        "segments": 5,
        "targetDuration": 6,
        "peakBitrateBps": 6000000,
        "videoRange": "SDR",
        "label": "source",
        "encoder": "copy"
      }
    ],
    "audio": [
      {
        "id": "a0",
        "dir": "hls/a0",
        "codec": "mp4a.40.2",
        "language": "eng",
        "title": "",
        "default": true,
        "channels": 2,
        "bitrateBps": 192000,
        "segments": 5,
        "visible": true,
        "purpose": "main",
        "purposeFrom": "assumed",
        "variant": null,
        "group": "audio",
        "name": "English"
      }
    ]
  },
  "subtitles": [],
  "trickplay": null,
  "hls": {
    "master": "hls/master.m3u8",
    "segmentSeconds": 6,
    "audioGroups": [
      "audio"
    ],
    "subtitleGroup": null
  },
  "trailers": [],
  "sizeBytes": 177,
  "peakBandwidthBps": 6192000,
  "fidelity": {
    "lossless": true,
    "losses": [],
    "droppedSourceStreams": []
  },
  "essence": {
    "maxAudioChannels": 2,
    "surround": false,
    "losslessAudio": false,
    "objectAudio": false,
    "maxVideoHeight": 800,
    "videoBitDepth": 8,
    "hdr10Metadata": false,
    "dolbyVision": false,
    "stereo3d": false,
    "interlaced": false,
    "audioLanguages": [
      "en"
    ],
    "subtitleLanguages": [],
    "subtitleTracks": 0,
    "imageSubtitles": false,
    "styledSubtitles": false,
    "fonts": false,
    "chapters": false,
    "commentaryTracks": 0,
    "commentarySubtitles": 0,
    "audioDescriptionTracks": 0,
    "sdhSubtitleLanguages": [],
    "forcedSubtitleLanguages": [],
    "closedCaptions": false
  },
  "checksums": {
    "file": "checksums.sha256",
    "algorithm": "sha256",
    "sha256": "sha256:0a669ca187e8b5dc72c7032e2fae07dbc138815a41cbd810e389159a2edfc13f",
    "files": 8,
    "bytes": 3584
  }
}
